{
  "$schema": "http://json-schema.org/draft-07/schema#",
  "title": "UserProfile",
  "type": "object",
  "required": ["uid", "displayName", "username", "email", "reputationScore", "joinedAt"],
  "properties": {
    "uid": { "type": "string" },
    "displayName": { "type": "string", "minLength": 2, "maxLength": 50 },
    "username": { "type": "string", "pattern": "^[a-zA-Z0-9_]{3,20}$" },
    "email": { "type": "string", "format": "email" },
    "avatarUrl": { "type": "string", "format": "uri" },
    "bio": { "type": "string", "maxLength": 280 },
    "reputationScore": { "type": "integer", "minimum": 0 },
    "joinedAt": { "type": "string", "format": "date-time" }
  }
}
